B07R48NZVD,"DJI Ronin-SC Stabilizer 3-Axis Gimbal for Mirrorless Camera Handheld Stabiliser Compatible with Sony Panasonic Lumix Nikon Canon, up to 2kg payload, Multi-Coloured",£279.00
1231231231,no data,no data
B01E4ZRX7O,Panasonic LUMIX DMC-GX80KEBK Professional Camera with 12-32 mm Lens - Black,£449.99
B00IE9XHE0,Sony A6000 Interchangeable Lens Digital Camera with SELP1650 Lens Kit - Black (24.3MP),£499.00
B011SG00BS,Panasonic Lumix DMC-FZ330EBK Bridge Camera with 25 - 600 mm Zoom and Full Range F2.8 - Black,£449.00
B07FS4Q3TH,"DJI Mini 2 Fly More Combo (UK) + Care Refresh (Auto-activated) - Ultralight and Portable Drone, Transmission 6 Km, 3-Axis Gimbal, Video HD 4K, service plan Included, Covers a Wide Variety of Accidents",£574.99
B0779B2K8B,Panasonic LUMIX DC-G9EB-K G9 Mirrorless Camera body only - Black,£899.00
B07H9J1YXN,"SanDisk Extreme PRO 64GB SDXC Memory Card up to 170MB/s, UHS-1, Class 10, U3, V30, Black",£18.80
